,text,intent,domain,dataset
2681,it is unimportant.,general_dontcare,general,train
2682,i don't bother.,general_dontcare,general,train
2683,anything is fine.,general_dontcare,general,train
2684,wouldn't mind to choose any one.,general_dontcare,general,train
2685,wouldn't really bother.,general_dontcare,general,train
2686,"have no idea about what to do, olly.",general_dontcare,general,train
2687,do not mind for any one.,general_dontcare,general,train
2688,whatever.,general_dontcare,general,train
2689,i don't really mind to choose any one.,general_dontcare,general,train
2690,do not mind to select any one.,general_dontcare,general,train
2691,wouldn't bother.,general_dontcare,general,train
2692,don't mind.,general_dontcare,general,train
2693,"would not mind to select any one, olly.",general_dontcare,general,train
2694,i do not care.,general_dontcare,general,train
2695,does not matter.,general_dontcare,general,train
2696,doesn't matter.,general_dontcare,general,train
2697,it doesn't matter to me.,general_dontcare,general,train
2698,whatever is good.,general_dontcare,general,train
2699,have no idea for which to choose.,general_dontcare,general,train
2700,this is unimportant to me.,general_dontcare,general,train
2701,whatever is okay for me.,general_dontcare,general,train
2702,this is unimportant.,general_dontcare,general,train
2703,i do not know.,general_dontcare,general,train
2704,"i would not bother, olly.",general_dontcare,general,train
2705,that doesn't really matter.,general_dontcare,general,train
2706,don't mind for whatever.,general_dontcare,general,train
2707,"have no idea for which to select, olly.",general_dontcare,general,train
2708,whatever will be fine.,general_dontcare,general,train
2709,don't mind to choose any one.,general_dontcare,general,train
2710,don't really know.,general_dontcare,general,train
2711,"really i don't mind, olly.",general_dontcare,general,train
2712,any one will be ok for me.,general_dontcare,general,train
2713,"anything would be good with me, olly.",general_dontcare,general,train
2714,"i have no idea for which to choose, olly.",general_dontcare,general,train
2715,"that is unimportant to me, olly.",general_dontcare,general,train
2716,"i have no idea for what to do, olly.",general_dontcare,general,train
2717,"really don't mind, olly.",general_dontcare,general,train
2718,don't really care.,general_dontcare,general,train
2719,does not really matter to me.,general_dontcare,general,train
2720,whatever would be good.,general_dontcare,general,train
2721,i have no idea regarding to what to select.,general_dontcare,general,train
2722,anything is ok for me.,general_dontcare,general,train
2723,this doesn't really matter to me.,general_dontcare,general,train
2724,"that does not really matter, olly.",general_dontcare,general,train
2725,don't bother.,general_dontcare,general,train
2726,"would not really care, olly.",general_dontcare,general,train
2727,"i do not really care, olly.",general_dontcare,general,train
2728,i don't mind to select any one.,general_dontcare,general,train
2729,"wouldn't really mind to choose any one, olly.",general_dontcare,general,train
2730,does not really matter with me.,general_dontcare,general,train
2731,"it is of no importance, olly.",general_dontcare,general,train
2732,this is of no importance to me.,general_dontcare,general,train
2733,that does not matter for me.,general_dontcare,general,train
2734,"i have no idea regarding to what to do, olly.",general_dontcare,general,train
2735,anything is okay for me.,general_dontcare,general,train
2736,"that doesn't matter to me, olly.",general_dontcare,general,train
2737,"i do not know, olly.",general_dontcare,general,train
2738,would not mind for any one.,general_dontcare,general,train
2739,anything will be ok with me.,general_dontcare,general,train
2740,"i do not really mind, olly.",general_dontcare,general,train
2741,doesn't matter with me.,general_dontcare,general,train
2742,wouldn't really care.,general_dontcare,general,train
2743,"do not really mind for whatever, olly.",general_dontcare,general,train
2744,once again clarify me about your answers please.,general_explain,general,train
2745,don't get this.,general_explain,general,train
2746,explain it further please.,general_explain,general,train
2747,"s1, rephrase me more on it.",general_explain,general,train
2748,would you once again clarify me about your response please.,general_explain,general,train
2749,i am unclear about your response.,general_explain,general,train
2750,please explain again to me.,general_explain,general,train
2751,further explain.,general_explain,general,train
2752,"s1, again clarify your answers please.",general_explain,general,train
2753,it was not clear.,general_explain,general,train
2754,"s1, would you please further clarify me on your answers.",general_explain,general,train
2755,"s2, i was not so clear about what you said now.",general_explain,general,train
2756,could you clarify me on it further.,general_explain,general,train
2757,could you please again clarify your answer to me.,general_explain,general,train
2758,please explain me more on what you said.,general_explain,general,train
2759,"s2, i was unclear about what you've just said.",general_explain,general,train
2760,"s1, will you further explain.",general_explain,general,train
2761,please further elaborate your response.,general_explain,general,train
2762,i am not so clear about your answers.,general_explain,general,train
2763,could you again elaborate me on your answers please.,general_explain,general,train
2764,"s1, rephrase me further on it please.",general_explain,general,train
2765,"s2, do not get your answer.",general_explain,general,train
2766,"s2, i can not catch up with you.",general_explain,general,train
2767,will you further elaborate me on what you have said please.,general_explain,general,train
2768,"s2, i was not clear about it.",general_explain,general,train
2769,i was unclear about what you have said.,general_explain,general,train
2770,i don't quite catch that.,general_explain,general,train
2771,i do not get the last sentence.,general_explain,general,train
2772,can you further explain me on it please.,general_explain,general,train
2773,again clarify me on your answers please.,general_explain,general,train
2774,"s1, please clarify me about your answers once again.",general_explain,general,train
2775,please further rephrase it.,general_explain,general,train
2776,i could not quite catch up with you.,general_explain,general,train
2777,i can not quite catch up with you.,general_explain,general,train
2778,your answer was not so clear.,general_explain,general,train
2779,"s1, can you please again rephrase to me.",general_explain,general,train
2780,elaborate me about your answers further.,general_explain,general,train
2781,can you please clarify once again.,general_explain,general,train
2782,"s2, i could not quite catch up with you.",general_explain,general,train
2783,"s1, can you rephrase me more on the last sentence please.",general_explain,general,train
2784,"s2, i was unclear about your answers.",general_explain,general,train
2785,will you explain me more on what you just said please.,general_explain,general,train
2786,what you have said is not so clear.,general_explain,general,train
2787,can you elaborate me on your answers again.,general_explain,general,train
2788,can you explain me further on what you just said.,general_explain,general,train
2789,what you just said was not so clear to me.,general_explain,general,train
2790,explain further please.,general_explain,general,train
2791,could you please further elaborate me about what you have just said.,general_explain,general,train
2792,i don't understand what you just said now.,general_explain,general,train
2793,your words was not so clear.,general_explain,general,train
2794,i do not catch up with you.,general_explain,general,train
2795,will you further elaborate me on it please.,general_explain,general,train
2796,would you please elaborate more on your response to me.,general_explain,general,train
2797,i did not catch that.,general_explain,general,train
2798,could you elaborate me more on your response please.,general_explain,general,train
2799,i was not clear about what you just said now.,general_explain,general,train
2800,i could not understand this.,general_explain,general,train
2801,explain further on last sentence to me please.,general_explain,general,train
2802,please rephrase more on what you have just said to me.,general_explain,general,train
2803,can you please further explain me about that.,general_explain,general,train
2804,further elaborate me on what you have said please.,general_explain,general,train
2805,once again elaborate me on that.,general_explain,general,train
2806,i don't get this.,general_explain,general,train
2807,"s2, i don't get your words.",general_explain,general,train
2808,please rephrase me more on what you said now.,general_explain,general,train
2809,what did you mean by it.,general_explain,general,train
2810,"s1, will you please further explain me about what you said.",general_explain,general,train
2811,could you clarify further on what you said now to me please.,general_explain,general,train
2812,"s2, i am unclear about it.",general_explain,general,train
2813,i am unclear about your answer.,general_explain,general,train
2814,would you again explain the last sentence to me please.,general_explain,general,train
2815,please explain me more on what you've just said.,general_explain,general,train
2816,i am not so clear about that.,general_explain,general,train
2817,what do you mean.,general_explain,general,train
2818,will you once again rephrase me about what you just said now.,general_explain,general,train
2819,i was not so clear about your answers.,general_explain,general,train
2820,"s1, again elaborate me on what you have just said please.",general_explain,general,train
2821,explain further.,general_explain,general,train
2822,"s2, i was not clear about that.",general_explain,general,train
2823,please will you elaborate further on last sentence.,general_explain,general,train
2824,will you please clarify again.,general_explain,general,train
2825,explain me further on what you have said please.,general_explain,general,train
2826,please will you explain me more on what you've said.,general_explain,general,train
2827,"s1, please explain me more on your answers.",general_explain,general,train
2828,will you explain me about the last sentence further please.,general_explain,general,train
2829,what do you mean by it.,general_explain,general,train
2830,what you have said was not so clear.,general_explain,general,train
2831,"s2, i am unclear about your words.",general_explain,general,train
2832,will you please rephrase me further on that.,general_explain,general,train
2833,can you please further elaborate what you just said.,general_explain,general,train
2834,i couldn't get what you've said.,general_explain,general,train
2835,can you elaborate further on this to me please.,general_explain,general,train
2836,"s2, i could not catch up with you.",general_explain,general,train
2837,can you please clarify me more on your answers.,general_explain,general,train
2838,what did you mean by saying this.,general_explain,general,train
2839,could not understand it.,general_explain,general,train
2840,would you please once again explain me about your words.,general_explain,general,train
2841,"s2, do not get the last sentence.",general_explain,general,train
2842,i don't understand what you have said.,general_explain,general,train
2843,"s2, can not get this.",general_explain,general,train
2844,your response was not clear.,general_explain,general,train
2845,"s2, i can not quite catch that.",general_explain,general,train
2846,please once again rephrase me about what you have said.,general_explain,general,train
2847,i didn't catch that.,general_explain,general,train
2848,will you rephrase this again to me please.,general_explain,general,train
2849,"s1, explain more on your response.",general_explain,general,train
2850,"s2, i didn't catch up with you.",general_explain,general,train
2851,rephrase me about what you've said further please.,general_explain,general,train
2852,please clarify once again.,general_explain,general,train
2853,can you please explain more on last sentence to me.,general_explain,general,train
2854,"s1, would you further elaborate to me please.",general_explain,general,train
2855,"s2, last sentence was not clear.",general_explain,general,train
2856,"s2, i didn't catch that.",general_explain,general,train
2857,clarify further on that to me please.,general_explain,general,train
2858,please elaborate once again to me.,general_explain,general,train
2859,i did not quite catch that.,general_explain,general,train
2860,your answer is not clear.,general_explain,general,train
2861,i was not clear about your response.,general_explain,general,train
2862,could you once again rephrase me about your answers.,general_explain,general,train
2863,"s1, please explain further on your words to me.",general_explain,general,train
2864,i am not so clear about what you just said.,general_explain,general,train
2865,i am not clear about your answers.,general_explain,general,train
2866,i am not clear about last sentence.,general_explain,general,train
2867,will you rephrase me on what you've just said again please.,general_explain,general,train
2868,will you explain me about what you have said once again please.,general_explain,general,train
2869,what did you mean by saying it.,general_explain,general,train
2870,would you please once again rephrase me on your answers.,general_explain,general,train
2871,rephrase further on your response please.,general_explain,general,train
2872,"s2, i didn't quite catch that.",general_explain,general,train
2873,would you again clarify me on it.,general_explain,general,train
2874,have you made a mistake.,general_explain,general,train
2875,"s1, please once again clarify to me.",general_explain,general,train
2876,"s1, can you further clarify me on it.",general_explain,general,train
2877,will you please again elaborate.,general_explain,general,train
2878,can you please clarify me about this further.,general_explain,general,train
2879,could you elaborate further on your answers to me.,general_explain,general,train
2880,once again elaborate me on what you have just said please.,general_explain,general,train
2881,"s1, again explain to me please.",general_explain,general,train
2882,"s1, would you elaborate further on your answer to me please.",general_explain,general,train
2883,can you please clarify me more on your answer.,general_explain,general,train
2884,"s1, could you please clarify me about what you've just said once again.",general_explain,general,train
2885,"s1, further rephrase me about what you just said now please.",general_explain,general,train
2886,"s2, i was unclear about your response.",general_explain,general,train
2887,didn't understand your answers.,general_explain,general,train
2888,please will you further clarify me on that.,general_explain,general,train
2889,once again explain your answer.,general_explain,general,train
2890,"s1, please again elaborate me about your answer.",general_explain,general,train
2891,i am not clear about your words.,general_explain,general,train
2892,could you rephrase me about your response again please.,general_explain,general,train
2893,please will you clarify me more on it.,general_explain,general,train
2894,please explain me about your words once again.,general_explain,general,train
2895,please rephrase again to me.,general_explain,general,train
2896,"s1, rephrase this further.",general_explain,general,train
2897,elaborate me further on your answer please.,general_explain,general,train
2898,i was not so clear about your words.,general_explain,general,train
2899,would you again rephrase me on your words please.,general_explain,general,train
2900,can you tell me a nice joke,general_joke,general,train
2901,say joke,general_joke,general,train
2902,i need to find a funny joke that is ok for kids,general_joke,general,train
2903,do you know any good jokes,general_joke,general,train
2904,do you know any jokes,general_joke,general,train
2905,i need a good joke,general_joke,general,train
2906,the joke of the day,general_joke,general,train
2907,humor me,general_joke,general,train
2908,find me the best knock knock joke on the internet,general_joke,general,train
2909,tell me joke,general_joke,general,train
2910,tell me a joke about birds,general_joke,general,train
2911,what is the funniest joke ever,general_joke,general,train
2912,what's the funniest joke you know,general_joke,general,train
2913,say some jokes,general_joke,general,train
2914,i need a funny joke to tell sam,general_joke,general,train
2915,please tell me a joke,general_joke,general,train
2916,tell joke,general_joke,general,train
2917,tell me a joke about a man,general_joke,general,train
2918,hey olly make me laugh with a good joke,general_joke,general,train
2919,tell me a good joke,general_joke,general,train
2920,cheer me up,general_joke,general,train
2921,tell me a joke about aliens,general_joke,general,train
2922,hey tell me a knock knock joke,general_joke,general,train
2923,find jokes on the web,general_joke,general,train
2924,make me laugh i want to hear a joke,general_joke,general,train
2925,i want to hear a joke,general_joke,general,train
2926,open some cools jokes,general_joke,general,train
2927,hey share me some joke to make me happy,general_joke,general,train
2928,joke of the day,general_joke,general,train
2929,tell me a dirty joke,general_joke,general,train
2930,find a joke in your vault and tell me,general_joke,general,train
2931,share me a joke,general_joke,general,train
2932,what is a good joke,general_joke,general,train
2933,how many jokes do you know,general_joke,general,train
2934,make me smile by telling a joke,general_joke,general,train
2935,do you know any joke,general_joke,general,train
2936,what is the highest rated joke today,general_joke,general,train
2937,joke me,general_joke,general,train
2938,any funny jokes,general_joke,general,train
2939,tell me a clean joke,general_joke,general,train
2940,search for new jokes,general_joke,general,train
2941,what's a good joke,general_joke,general,train
2942,tell me a joke about chickens,general_joke,general,train
2943,say a funny,general_joke,general,train
2944,do you have a funny joke for me,general_joke,general,train
2945,a joke please,general_joke,general,train
2946,can you find an animal joke for me,general_joke,general,train
2947,make me laugh,general_joke,general,train
2948,could you tell me funny things,general_joke,general,train
2949,say something funny,general_joke,general,train
2950,tell me a joke about dogs,general_joke,general,train
2951,tell me the funniest joke that was ever told,general_joke,general,train
2952,are you aware this joke,general_joke,general,train
2953,find funny jokes,general_joke,general,train
2954,let me laugh hearing some good joke,general_joke,general,train
2955,funny joke,general_joke,general,train
2956,tell me a good doctor joke,general_joke,general,train
2957,what is your best joke,general_joke,general,train
2958,funny story,general_joke,general,train
2959,tell me some funny joke to laugh,general_joke,general,train
2960,let me hear a joke,general_joke,general,train
2961,search for a good nerd joke,general_joke,general,train
2962,i want to listen to a joke,general_joke,general,train
2963,say a good joke for me right now,general_joke,general,train
2964,send a giggle my way,general_joke,general,train
2965,hey do you know any jokes,general_joke,general,train
2966,tell funny things,general_joke,general,train
2967,i need to hear a joke can you tell me one,general_joke,general,train
2968,i wanna laugh can you make it happen,general_joke,general,train
2969,what is a funny joke,general_joke,general,train
2970,i want to hear a funny joke,general_joke,general,train
2971,tell me a joke about lawyers,general_joke,general,train
2972,tell me a joke please,general_joke,general,train
2973,tell me some joke,general_joke,general,train
2974,show me a funny joke,general_joke,general,train
2975,jokes,general_joke,general,train
2976,tell me a funny joke,general_joke,general,train
2977,find the joke about the orange and the banana,general_joke,general,train
2978,be funny for me,general_joke,general,train
2979,i want to hear a good joke,general_joke,general,train
2980,please tell me a joke that i'll think is funny,general_joke,general,train
2981,hey olly have you heard any funny jokes lately,general_joke,general,train
2982,can you tell me a joke,general_joke,general,train
2983,have you heard any good jokes lately,general_joke,general,train
2984,i need a naughty joke not to naughty though,general_joke,general,train
2985,what is a funny joke about car,general_joke,general,train
2986,what's the famous monty python joke about the bird,general_joke,general,train
2987,what's the funniest joke,general_joke,general,train
2988,whats a silly joke you know,general_joke,general,train
2989,tell me jokes,general_joke,general,train
2990,tell a joke,general_joke,general,train
2991,crack a joke,general_joke,general,train
2992,what's the latest joke,general_joke,general,train
2993,a priest walks into a bar,general_joke,general,train
2994,whats a good joke,general_joke,general,train
2995,tell me something funny,general_joke,general,train
2996,tell a joke that puts smile on my face,general_joke,general,train
2997,can i hear the joke about the old woman again,general_joke,general,train
2998,i think you messed up with my command.,general_negate,general,train
2999,this was not what i am searching for.,general_negate,general,train
3000,"uhh no, that's not what i am searching for.",general_negate,general,train
3001,you told me the incorrect date please correct this.,general_negate,general,train
3002,"nope, i did not say it.",general_negate,general,train
3003,"shit, i didn't ask for this.",general_negate,general,train
3004,sorry but it was not the correct response.,general_negate,general,train
3005,incorrect command.,general_negate,general,train
3006,thanks but this is not the right response.,general_negate,general,train
3007,goddammit.,general_negate,general,train
3008,i am sorry but that's not the correct response.,general_negate,general,train
3009,"dammit, it isn't what i asked.",general_negate,general,train
3010,are you sure that is correct.,general_negate,general,train
3011,"stop, this is not right answer.",general_negate,general,train
3012,"oh no, you gave me not right information.",general_negate,general,train
3013,thanks but i think you did not get the answer correctly.,general_negate,general,train
3014,sorry but that is not the right answer.,general_negate,general,train
3015,"uhh no, i did not say this.",general_negate,general,train
3016,"dammit, that's not what i meant.",general_negate,general,train
3017,thanks but i think that was not the correct command.,general_negate,general,train
3018,that was incorrect let's try again.,general_negate,general,train
3019,"no, i think that's not the right response.",general_negate,general,train
3020,you didn't say my name right.,general_negate,general,train
3021,it seems like olly's command was not right.,general_negate,general,train
3022,i think you've done this all in wrong manner.,general_negate,general,train
3023,dont do that again.,general_negate,general,train
3024,i did not say it.,general_negate,general,train
3025,"uh no, you've done in wrong manner.",general_negate,general,train
3026,it's not the correct command.,general_negate,general,train
3027,"oops, i think this was not the right response.",general_negate,general,train
3028,thanks but i think this was not the correct command.,general_negate,general,train
3029,"uhh no, you didn't interpret the request right.",general_negate,general,train
3030,that isn't what i meant.,general_negate,general,train
3031,i think this was not correct.,general_negate,general,train
3032,"wait, this is not the right command.",general_negate,general,train
3033,thanks but you didn't get me.,general_negate,general,train
3034,"shit, you've done a task wrong.",general_negate,general,train
3035,thanks but i think you have messed up my request.,general_negate,general,train
3036,"nope, incorrect command.",general_negate,general,train
3037,thanks but you have got it incorrect.,general_negate,general,train
3038,i think you did not get this right.,general_negate,general,train
3039,sorry but that was not the correct response.,general_negate,general,train
3040,i am sorry but that is not the right answer.,general_negate,general,train
3041,thanks but i think you do not understand this right.,general_negate,general,train
3042,i think that's not correct answer.,general_negate,general,train
3043,please make sure your command was correct because it doesn't sound right.,general_negate,general,train
3044,please check the command.,general_negate,general,train
3045,i am sorry but i think you have messed up with my request.,general_negate,general,train
3046,sorry but i think you are not right.,general_negate,general,train
3047,sorry but it is not correct.,general_negate,general,train
3048,i am sorry but i think that's not correct.,general_negate,general,train
3049,"dammit, it isn't what i am looking for.",general_negate,general,train
3050,"shit, not correct.",general_negate,general,train
3051,this is not the correct answer.,general_negate,general,train
3052,i asked for something else.,general_negate,general,train
3053,"i think you made mistake, please change this.",general_negate,general,train
3054,listen carefully that is not correct.,general_negate,general,train
3055,"oops, that's not the right response.",general_negate,general,train
3056,"uh no, i think incorrect command.",general_negate,general,train
3057,i did not ask for that.,general_negate,general,train
3058,i am sorry but i think it's not the right command.,general_negate,general,train
