,text,intent,domain,dataset
5539,political news of importance for the day,news_query,news,train
5540,what happened yesterday on samurai jack,news_query,news,train
5541,what's the latest news about us election,news_query,news,train
5542,latest updates on syrian civil war,news_query,news,train
5543,i need sport's news,news_query,news,train
5544,get me the latest news of world,news_query,news,train
5545,what is happening in the world today,news_query,news,train
5546,keep me up to date on the election news,news_query,news,train
5547,access latest news,news_query,news,train
5548,which teams are playing today in the premier league,news_query,news,train
5549,let me know if anything happens on that subject,news_query,news,train
5550,show latest news about migration,news_query,news,train
5551,the current news,news_query,news,train
5552,please tell me the news,news_query,news,train
5553,give me the headlines from sky news,news_query,news,train
5554,is there any new news on trump,news_query,news,train
5555,give me the latest updates,news_query,news,train
5556,pull up my cnn app and read it to me,news_query,news,train
5557,can you tell me a latest news,news_query,news,train
5558,google search the topic,news_query,news,train
5559,can the latest news be pulled up on the latest weather forecast for the week,news_query,news,train
5560,how is the news in ireland,news_query,news,train
5561,what is the latest on donald trump,news_query,news,train
5562,update me on the standing rock protest,news_query,news,train
5563,new policies,news_query,news,train
5564,please advise what the current news is on fox news,news_query,news,train
5565,latest news update,news_query,news,train
5566,what's happening with the hurricane in the gulf,news_query,news,train
5567,The latest climate and weather news,news_query,news,train
5568,cnn,news_query,news,train
5569,what's the news in politics,news_query,news,train
5570,celeb news,news_query,news,train
5571,what's the news in politics on cnn,news_query,news,train
5572,what's the news from source,news_query,news,train
5573,pull up the headlines please,news_query,news,train
5574,entertainment news,news_query,news,train
5575,olly schedule a news update for tomorrow morning at seven am,news_query,news,train
5576,i want to see the news,news_query,news,train
5577,tell me the latest news from bbc sports,news_query,news,train
5578,how about the latest news,news_query,news,train
5579,what are the results of the election,news_query,news,train
5580,cnn world news,news_query,news,train
5581,get me the latest on current events going on in the world,news_query,news,train
5582,what's going around in the world these days,news_query,news,train
5583,give me the morning news,news_query,news,train
5584,economic affairs,news_query,news,train
5585,provide wall street journal news,news_query,news,train
5586,what's happening in news express,news_query,news,train
5587,give me the news on donald trump,news_query,news,train
5588,whats happening in football today,news_query,news,train
5589,what is currently breaking news,news_query,news,train
5590,are there any status updates on cnn news facebook page,news_query,news,train
5591,newest world news,news_query,news,train
5592,any local news stories for my home city,news_query,news,train
5593,please provide world hot news,news_query,news,train
5594,current news cnn,news_query,news,train
5595,show me the latest news from the un,news_query,news,train
5596,read me the front page of the new york times,news_query,news,train
5597,please tell me some international news,news_query,news,train
5598,will trump visit russia anytime soon,news_query,news,train
5599,did the yankees win last night,news_query,news,train
5600,give me election updates,news_query,news,train
5601,notification regarding the new iphone release update,news_query,news,train
5602,get news from bbc,news_query,news,train
5603,iphone,news_query,news,train
5604,give me the news,news_query,news,train
5605,i want to read yahoo news,news_query,news,train
5606,headlines from dhaka tribune,news_query,news,train
5607,what is the headline from today's morning local news,news_query,news,train
5608,get me the latest news in new york,news_query,news,train
5609,what are the news stories on the cnn website,news_query,news,train
5610,latest news,news_query,news,train
5611,what is trending in tech today,news_query,news,train
5612,give me the headline news,news_query,news,train
5613,get me fresh news,news_query,news,train
5614,please share up to the minute details on sprint,news_query,news,train
5615,any recent news about north korea,news_query,news,train
5616,tell the latest news about the trump,news_query,news,train
5617,tell me updates,news_query,news,train
5618,is india win today cricket match,news_query,news,train
5619,automobiles,news_query,news,train
5620,is snap doing good after the ipo,news_query,news,train
5621,can you search trump,news_query,news,train
5622,progress from the last paused point of my audio book,play_audiobook,play,train
5623,go back to animal farm,play_audiobook,play,train
5624,play next episode of harry potter by j. k. rowling,play_audiobook,play,train
5625,resume the two towers,play_audiobook,play,train
5626,start playing again,play_audiobook,play,train
5627,resume lord of the rings,play_audiobook,play,train
5628,resume the reading of the french lesson,play_audiobook,play,train
5629,can you put on the giver,play_audiobook,play,train
5630,read that back,play_audiobook,play,train
5631,start audio playback of twilight again,play_audiobook,play,train
5632,i want to finally read the mars trilogy,play_audiobook,play,train
5633,pick up we left off on battle royale,play_audiobook,play,train
5634,i would like to listen to my audiobook,play_audiobook,play,train
5635,lets have a break for five minutes,play_audiobook,play,train
5636,resume the two towers audiobook,play_audiobook,play,train
5637,can you play my favorite audio book of king kong,play_audiobook,play,train
5638,i want to listen to treasure island by robert louis stevenson,play_audiobook,play,train
5639,resume pride and prejudice,play_audiobook,play,train
5640,play the game of thrones audio book from the last chapter i was on,play_audiobook,play,train
5641,play the book which i heard on some particular day,play_audiobook,play,train
5642,stop play,play_audiobook,play,train
5643,get me resume of newest release audio book,play_audiobook,play,train
5644,keep playing secret garden,play_audiobook,play,train
5645,can you pause and rewind the audio then resume,play_audiobook,play,train
5646,play the last played audiobook,play_audiobook,play,train
5647,start reading that alan partridge book,play_audiobook,play,train
5648,play magic run after thirty min,play_audiobook,play,train
5649,resume play on my most recent audiobook selection,play_audiobook,play,train
5650,start reading fifty shades of grey from chapter four,play_audiobook,play,train
5651,start chapter five of physics for future presidents,play_audiobook,play,train
5652,continue pride and prejudice,play_audiobook,play,train
5653,resume audio,play_audiobook,play,train
5654,read some more of the daisy goodwin book for me,play_audiobook,play,train
5655,can you play my latest audio book,play_audiobook,play,train
5656,open harrypotter audiobook and play from last played,play_audiobook,play,train
5657,play audiobook of planets,play_audiobook,play,train
5658,resume my audiobook from the beginning of the last chapter i started,play_audiobook,play,train
5659,resume the last played audiobook,play_audiobook,play,train
5660,open book,play_audiobook,play,train
5661,i need a break start it after five minutes,play_audiobook,play,train
5662,resume playback,play_audiobook,play,train
5663,pick up wuthering heights where we left off,play_audiobook,play,train
5664,audio start,play_audiobook,play,train
5665,please restart the handmaid's tale,play_audiobook,play,train
5666,book swan resume,play_audiobook,play,train
5667,resume play of american gods,play_audiobook,play,train
5668,play pride and prejudice,play_audiobook,play,train
5669,play the twilight book,play_audiobook,play,train
5670,play me a random audio book that has to do with love,play_audiobook,play,train
5671,can you put on the chuck palhunik audio book,play_audiobook,play,train
5672,i want you to fast forward the audio then resume,play_audiobook,play,train
5673,resume the playback of zanes se chronicles,play_audiobook,play,train
5674,hold,play_audiobook,play,train
5675,start over the book legacy,play_audiobook,play,train
5676,resume playing the miniaturist,play_audiobook,play,train
5677,open the davinci code where i left off,play_audiobook,play,train
5678,open the books and play brains book from chap nine,play_audiobook,play,train
5679,start from last time on my audio book,play_audiobook,play,train
5680,i would like to continue my audiobook,play_audiobook,play,train
5681,resuming playing my current audio book,play_audiobook,play,train
5682,pause the book,play_audiobook,play,train
5683,resume the audiobook i listened to last,play_audiobook,play,train
5684,play the client by john grisham,play_audiobook,play,train
5685,play audiobook snow white,play_audiobook,play,train
5686,resume the playback of a child called it,play_audiobook,play,train
5687,continue audiobook playback,play_audiobook,play,train
5688,resume audiobook please,play_audiobook,play,train
5689,read me some more deadly death killers,play_audiobook,play,train
5690,play fault in our stars on audible,play_audiobook,play,train
5691,start my bible study book again,play_audiobook,play,train
5692,play audio,play_audiobook,play,train
5693,open audible and continue playing the book that i was listening to,play_audiobook,play,train
5694,continue playing where I left off,play_audiobook,play,train
5695,start chapter seven of alma,play_audiobook,play,train
5696,continue from where we left off in divergent,play_audiobook,play,train
5697,please continue reading the hunger games,play_audiobook,play,train
5698,play seven habits of effective people,play_audiobook,play,train
5699,play my bookmarked audiobook,play_audiobook,play,train
5700,play audiobook,play_audiobook,play,train
5701,continue with my audiobook please,play_audiobook,play,train
5702,play it after five minutes,play_audiobook,play,train
5703,start audiobook again,play_audiobook,play,train
5704,resume harry potter from the place i have stopped listening to last time,play_audiobook,play,train
5705,please pause this audio book now,play_audiobook,play,train
5706,put on the god of small things,play_audiobook,play,train
5707,continue playing my book of vitamins,play_audiobook,play,train
5708,list me the audiobooks i have already listened to,play_audiobook,play,train
5709,resume mind reading book,play_audiobook,play,train
5710,resume harry potter book five,play_audiobook,play,train
5711,resume audiobook,play_audiobook,play,train
5712,resume last played audiobook,play_audiobook,play,train
5713,resume inkheart,play_audiobook,play,train
5714,play this audiobook,play_audiobook,play,train
5715,play audiobook where we left off,play_audiobook,play,train
5716,open the two towers,play_audiobook,play,train
5717,play the davinci code,play_audiobook,play,train
5718,please play back some important points summary,play_audiobook,play,train
5719,start my audio book from where i left off,play_audiobook,play,train
5720,play the circle,play_audiobook,play,train
5721,play audiobook of jacob,play_audiobook,play,train
5722,can you continue audiobook the circle,play_audiobook,play,train
5723,please continue reading audiobook,play_audiobook,play,train
5724,base on my audiobook collection get me recommendation related audio book i should listen get and play me the resume,play_audiobook,play,train
5725,i want to listen to be more chill by ned vizzini,play_audiobook,play,train
5726,please play recently paused audio,play_audiobook,play,train
5727,play biography of jackie kennedy,play_audiobook,play,train
5728,play recently added audiobook,play_audiobook,play,train
5729,can you play hunt for red october,play_audiobook,play,train
5730,play the scarlet letter,play_audiobook,play,train
5731,start reading book,play_audiobook,play,train
5732,resume joes book from where i left off last time,play_audiobook,play,train
5733,play my book,play_audiobook,play,train
5734,lets listen to hunt for read october,play_audiobook,play,train
5735,restart the audiobook heaven is for real,play_audiobook,play,train
5736,restart bill nye book,play_audiobook,play,train
5737,play the time machine by h g wells,play_audiobook,play,train
5738,continue playing my audiobook,play_audiobook,play,train
5739,please resume this playback in audiobook,play_audiobook,play,train
5740,read the audiobook of war of the roses,play_audiobook,play,train
5741,play the program where i left off yesterday,play_audiobook,play,train
5742,play book,play_audiobook,play,train
5743,i want to play the audiobook good grief,play_audiobook,play,train
5744,begin again book swan,play_audiobook,play,train
5745,keep playing war and peace,play_audiobook,play,train
5746,please play this playback on audiobook,play_audiobook,play,train
5747,resume audio book history of rome,play_audiobook,play,train
5748,get me resume of best seller audio book this month,play_audiobook,play,train
5749,play me harry potter from the place i last stopped listening on,play_audiobook,play,train
5750,resume playing the current audiobook,play_audiobook,play,train
5751,i want to hear the book written by the mother of the shooter at columbine,play_audiobook,play,train
5752,play wuthering heights from where i left off,play_audiobook,play,train
5753,i would like to start this new audiobook,play_audiobook,play,train
5754,playback tom clancy splinter cell,play_audiobook,play,train
5755,open davinci code audiobook,play_audiobook,play,train
5756,can you pause the audio,play_audiobook,play,train
5757,please open audible app and resume play,play_audiobook,play,train
5758,start dune from where i left off,play_audiobook,play,train
5759,please repeat the last sentence from that book,play_audiobook,play,train
5760,resume harry potter book one,play_audiobook,play,train
5761,restart american gods,play_audiobook,play,train
5762,start play johns audiobook,play_audiobook,play,train
5763,resume audio playback of twilight,play_audiobook,play,train
5764,please continue playing odd thomas by dean koontz,play_audiobook,play,train
5765,stop audiobook,play_audiobook,play,train
5766,pause the audiobook,play_audiobook,play,train
5767,i want to start war and peace where i left off,play_audiobook,play,train
5768,look for this playback in audiobook and play for me,play_audiobook,play,train
5769,play the jungle book,play_audiobook,play,train
5770,play this audiobook for me,play_audiobook,play,train
5771,resume playing you are joking mr feynman,play_audiobook,play,train
5772,play the god of small things,play_audiobook,play,train
5773,play the two towers,play_audiobook,play,train
5774,find me an audio book version of ready player one and play it for me,play_audiobook,play,train
5775,begin playing the audiobook beauty and the beast,play_audiobook,play,train
5776,play the audiobook swan from first,play_audiobook,play,train
5777,resume audiobook playback,play_audiobook,play,train
5778,we are going to play poker together,play_game,play,train
5779,can you take a role of enemy in the game of coc,play_game,play,train
5780,run game,play_game,play,train
5781,open parcheese game for you and i,play_game,play,train
5782,let's roll the dice,play_game,play,train
5783,can you do name that tune,play_game,play,train
5784,play the latest games,play_game,play,train
5785,start up bejeweled,play_game,play,train
5786,let's play our favourite football match on tv,play_game,play,train
5787,play this game with me,play_game,play,train
5788,find game,play_game,play,train
5789,list the games you can play with me,play_game,play,train
5790,can you play monopoly with me,play_game,play,train
5791,play flappy bird,play_game,play,train
5792,i need to play sims,play_game,play,train
5793,turn on flappy bird,play_game,play,train
5794,let's play space invaders,play_game,play,train
5795,start words with friends,play_game,play,train
5796,i challenge you to a game of tic tac toe,play_game,play,train
5797,please open blokus game i would like to play with you,play_game,play,train
5798,Please play this game,play_game,play,train
5799,open tic tac toe,play_game,play,train
5800,open games,play_game,play,train
5801,play gta vice city game,play_game,play,train
5802,please play football with me,play_game,play,train
5803,play chess,play_game,play,train
5804,play for me the game cricket,play_game,play,train
5805,play scrabble with me,play_game,play,train
5806,play me a game of tic tac toe,play_game,play,train
5807,let's play fmod,play_game,play,train
5808,lets play,play_game,play,train
5809,please begin clash of clans,play_game,play,train
5810,open chess app and begin game,play_game,play,train
5811,do a tournament with me in candy crush,play_game,play,train
5812,shall we play a game,play_game,play,train
5813,open up tetris,play_game,play,train
5814,please play trivial pursuit with me,play_game,play,train
5815,let's play chess,play_game,play,train
5816,i feel like playing chess can you play that,play_game,play,train
5817,open temple run game,play_game,play,train
5818,open chess play against me,play_game,play,train
5819,play football with me,play_game,play,train
5820,play papa pear saga,play_game,play,train
5821,play tic tac toe with me,play_game,play,train
5822,play subway surfers with me,play_game,play,train
5823,lets play chess together,play_game,play,train
5824,play game,play_game,play,train
5825,can you play tic tac toe,play_game,play,train
5826,play a game of contra as a second player,play_game,play,train
5827,play a game of chess with me,play_game,play,train
5828,please play my cricket game,play_game,play,train
5829,Lets play tic tac toe,play_game,play,train
5830,mario,play_game,play,train
5831,start angry bird,play_game,play,train
5832,want to play a game of trivia,play_game,play,train
5833,want to play a game,play_game,play,train
5834,i want to play a game,play_game,play,train
5835,let's play space invaders together,play_game,play,train
5836,play for me the game star wars,play_game,play,train
5837,my games to play in my computers,play_game,play,train
5838,i want to play a trivia game,play_game,play,train
5839,can you play a game with me,play_game,play,train
5840,Play my favorite game by name naughty dog,play_game,play,train
5841,play candy crush,play_game,play,train
5842,play football match for myself now,play_game,play,train
5843,start game temple runner,play_game,play,train
5844,let's play tic tac toe,play_game,play,train
5845,please open chess game i would like to play with you,play_game,play,train
5846,open subway surfers,play_game,play,train
5847,search for the correct game,play_game,play,train
5848,i want to play poker with you,play_game,play,train
5849,load up ghost recon wildlands,play_game,play,train
5850,let's play a game together,play_game,play,train
5851,play ping pong,play_game,play,train
5852,open chess game,play_game,play,train
5853,open saga,play_game,play,train
5854,i want you to play this game for me,play_game,play,train
5855,i challenge you to a game,play_game,play,train
5856,lets play battleship,play_game,play,train
5857,let's play global thermonuclear war,play_game,play,train
5858,start a game and play with me,play_game,play,train
5859,start the poker game,play_game,play,train
5860,let's play some pong,play_game,play,train
5861,please play clash of clans,play_game,play,train
5862,lets play tic tac toe,play_game,play,train
5863,i want to play a game with you,play_game,play,train
5864,please choose a game that you can play with me,play_game,play,train
5865,please open and play chess with me,play_game,play,train
5866,could you play poker with me,play_game,play,train
5867,play poker with me,play_game,play,train
5868,video games,play_game,play,train
5869,load a fun game that i can play with you,play_game,play,train
5870,play for me the game harry potter and the chamber of secrets,play_game,play,train
5871,let's play a game of truth or dare,play_game,play,train
5872,lets go nazi hunting,play_game,play,train
5873,launch super mario,play_game,play,train
5874,play cricket,play_game,play,train
5875,get the duet game,play_game,play,train
5876,play game with me,play_game,play,train
5877,play real racing three game,play_game,play,train
5878,play super mario brothers game with me,play_game,play,train
5879,start a match of chess,play_game,play,train
5880,let's play a game of chess,play_game,play,train
5881,play chess with me please,play_game,play,train
5882,would you like to play a game,play_game,play,train
5883,play solitaire with me,play_game,play,train
5884,i'm thinking of a number one to ten,play_game,play,train
5885,let's play you'll be the keeper and never change position,play_game,play,train
5886,start a competitive crossword for us,play_game,play,train
5887,would you like to play a game with me,play_game,play,train
5888,let's play nine ball against me adapt with my skill level always let me win,play_game,play,train
5889,could you harvest the crops in farmvile,play_game,play,train
5890,please open go fish game and play it with me,play_game,play,train
5891,open fishdom game,play_game,play,train
5892,open minestart game from previous played level,play_game,play,train
5893,open up angry birds,play_game,play,train
5894,i want to play fifa seventeen,play_game,play,train
5895,lets play pinball,play_game,play,train
5896,I'd like to play UNO with you,play_game,play,train
5897,play uno together,play_game,play,train
5898,want to play a game with me,play_game,play,train
5899,play candy crush with me,play_game,play,train
5900,let's play never have i ever,play_game,play,train
5901,can you find animal crossing,play_game,play,train
5902,i would like to play tetris,play_game,play,train
5903,start spider,play_game,play,train
5904,puzzles and games app,play_game,play,train
5905,please open snooker game i would like to play with you,play_game,play,train
5906,how about playing a game of guess the word i'm thinking of,play_game,play,train
5907,play keno,play_game,play,train
5908,play games,play_game,play,train
5909,do you want to play,play_game,play,train
5910,play scabble with me,play_game,play,train
5911,play for me the game candy crush,play_game,play,train
5912,angry bird play,play_game,play,train
5913,turn on console,play_game,play,train
5914,give a hand to this game,play_game,play,train
5915,let's play a game,play_game,play,train
5916,i want to play blackjack,play_game,play,train
5917,games,play_game,play,train
5918,start the league of legends game,play_game,play,train
5919,how about a nice game of chess,play_game,play,train
5920,play fmod,play_game,play,train
5921,play i spy with me,play_game,play,train
5922,co play game monopoly,play_game,play,train
5923,start candy crush,play_game,play,train
5924,will play chess,play_game,play,train
5925,please run this game,play_game,play,train
5926,start play fifa seventeen,play_game,play,train
5927,play snake with me,play_game,play,train
5928,let us play millionaires,play_game,play,train
5929,play racing,play_game,play,train
5930,create a playing teams and play with them,play_game,play,train
5931,let's play a game of trivia,play_game,play,train
5932,let's play checkers,play_game,play,train
5933,play golf,play_game,play,train
5934,i wish i could play video games together,play_game,play,train
5935,try to play old nineties classic music,play_music,play,train
5936,play new rihanna song,play_music,play,train
5937,turn on some music,play_music,play,train
5938,can you play my favorite music,play_music,play,train
5939,play party songs,play_music,play,train
5940,please play the song games by disturbed,play_music,play,train
5941,i want to listen arijit singh song once again,play_music,play,train
5942,play my first favorite song on loop,play_music,play,train
5943,Play best friends by yelawolf,play_music,play,train
5944,start music,play_music,play,train
5945,turn on my michael jackson playlist,play_music,play,train
5946,play any song of arijit singh,play_music,play,train
5947,hey play the songs from my playlist named good tunes,play_music,play,train
5948,play melody songs,play_music,play,train
5949,start play,play_music,play,train
5950,start the satellite music feed,play_music,play,train
5951,play anything by cat stevens and i'll be happy,play_music,play,train
5952,take me to music player,play_music,play,train
5953,play the romantic songs,play_music,play,train
5954,play music for me,play_music,play,train
5955,please play michael jackson album,play_music,play,train
5956,play jack johnson playlist music,play_music,play,train
5957,find songs from my big band playlist,play_music,play,train
5958,play for me hip hop music,play_music,play,train
5959,play the last song from my most recent playlist,play_music,play,train
5960,i want to listen to rock,play_music,play,train
5961,i want to listen jazz,play_music,play,train
5962,i want to hear surfin usa,play_music,play,train
5963,play for me the music by the beatles,play_music,play,train
5964,google find and play florida georgia line the one with nelly,play_music,play,train
5965,play songs by adele,play_music,play,train
5966,play the bjork album i've heard the least,play_music,play,train
5967,get sia's cheap thrills ready to play next,play_music,play,train
5968,best rap music,play_music,play,train
5969,show me the best podcast of folk songs having good rating and play it,play_music,play,train
5970,play my most played songs,play_music,play,train
5971,play from favorites song,play_music,play,train
5972,play music by taylor swift,play_music,play,train
5973,reshuffle and play music,play_music,play,train
5974,set a classic music,play_music,play,train
5975,play led zeppelin houses of the holy,play_music,play,train
5976,please play the beatles ps i love you,play_music,play,train
